{
  "host_facts_schema_version": 1,
  "online_cpus": [0, 1, 2, 3, 4, 5, 6, 7, 8, 9, 10, 11, 12, 13, 14, 15],
  "online_numa_nodes": [0],
  "cpu_numa_nodes": {"0": 0, "1": 0, "2": 0, "3": 0, "4": 0, "5": 0, "6": 0, "7": 0, "8": 0, "9": 0, "10": 0, "11": 0, "12": 0, "13": 0, "14": 0, "15": 0},
  "hugepage_size_kb": 2048,
  "hugepage_total": 4096,
  "hugepages_by_numa_node": {"0": 4096},
  "interfaces": ["lo", "enp1s0f0"],
  "interface_numa_nodes": {"lo": 0, "enp1s0f0": 0},
  "hardware_timestamp_interfaces": ["enp1s0f0"],
  "receive_queue_counts": {"lo": 1, "enp1s0f0": 8}
}
